Id,Severity,Rule,CWE,Description,Mitigation Steps,Reference Link,Matched Files
"1","low","Weak Crypto Algorithms","CWE-327","Weak cryptographic algorithms are those with known vulnerabilities that make them susceptible to attacks. Their use can lead to unauthorized data access, manipulation, and disclosure. This is a security concern because it undermines the confidentiality, integrity, and availability of sensitive information.","To remediate weak cryptographic algorithms, immediately replace them with strong, modern alternatives such as AES-256, SHA-256, or ECC.  Upgrade any systems or applications using deprecated algorithms, ensuring compatibility during the transition.  Enforce the use of TLS 1.3 or higher for all network communications, and implement robust key management practices, including regular key rotation and secure storage using hardware security modules (HSMs).  Continuously monitor systems for the use of weak algorithms and conduct regular security audits to verify cryptographic strength and adherence to best practices.","https://developer.android.com/guide/topics/security/cryptography,https://cwe.mitre.org/data/definitions/327.html","DESKeySpec (sources/b3nac/injuredandroid/k.java)
DESKeySpec (sources/b3nac/injuredandroid/k.java)
DESKeySpec (sources/b3nac/injuredandroid/k.java)"
"2","low","Non-parameterized SQL Query","CWE-89","Non-parameterized SQL queries, also known as static SQL queries, are constructed without using parameters, making them vulnerable to SQL injection attacks. This occurs when user-supplied input is directly embedded into the SQL query string without proper sanitization or escaping. Attackers can exploit this vulnerability by injecting malicious SQL code through input fields, potentially leading to unauthorized data access, modification, or deletion.","To remediate non-parameterized SQL queries, the primary solution is to implement parameterized queries or prepared statements, which treat user input as data rather than executable code, preventing SQL injection.  Additionally, utilize stored procedures to encapsulate SQL logic and restrict direct SQL query construction. Employ an Object-Relational Mapping (ORM) framework to abstract database interactions and automatically handle parameterization and escaping.  Enforce strict input validation to sanitize user-provided data, removing or escaping special characters that could be exploited. Implement the principle of least privilege to limit the database permissions of application users, minimizing the impact of successful SQL injection attacks. Regularly update database systems and related libraries to patch known vulnerabilities and enhance security features.","https://developer.android.com/topic/security/risks/sql-injection, https://owasp.org/www-community/attacks/SQL_Injection","execSQL(""DROP TABLE IF EXISTS "" + str) (sources/com/google/firebase/database/m/i.java)"
"3","low","Possible Object Deserialization","CWE-502","Object deserialization vulnerabilities occur when an application deserializes untrusted data, potentially leading to remote code execution. Attackers can manipulate serialized data to inject malicious code that is executed during the deserialization process. This can compromise the application and the underlying system.","To mitigate object deserialization vulnerabilities, avoid deserializing untrusted data whenever possible. If deserialization is unavoidable, implement strict input validation to ensure that only expected data types and structures are processed. Consider using alternative data formats like JSON or XML, which are less susceptible to deserialization attacks. Employ deserialization filters or whitelists to restrict the classes that can be deserialized. Update libraries and frameworks to the latest versions to patch known deserialization vulnerabilities. Implement monitoring and logging to detect and respond to suspicious deserialization activity. Apply the principle of least privilege to minimize the impact of potential exploitation.","https://owasp.org/www-project-top-ten/2017/A8_2017-Insecure_Deserialization.html, https://cwe.mitre.org/data/definitions/502.html","new ObjectInputStream(new ByteArrayInputStream(Base64.decode(str, 0))); (sources/io/flutter/plugins/a/a.java)"
"4","low","Possible Task Hijacking","NA","Android Task Hijacking occurs when a malicious application exploits the back stack of a vulnerable application, replacing the expected activity with its own. This allows the malicious app to masquerade as the legitimate one. This is a security concern because it can lead to users unknowingly providing sensitive information to the malicious application, believing it to be the legitimate one. This can lead to data theft, financial loss, or other security breaches.","To mitigate task hijacking, developers should implement several preventative measures. Setting the `taskAffinity` attribute to an empty string (`""""`) in the application's manifest can isolate the application's tasks. Additionally, using the `singleInstance` launch mode prevents other activities from joining the application's tasks. Implementing a custom `onBackPressed()` function to override the default back button behavior can provide further control. Ensure activities that handle sensitive data are not exported or are properly protected with appropriate permissions. Regularly audit and update dependencies to patch any known vulnerabilities that could be exploited for task hijacking.","https://book.hacktricks.xyz/mobile-pentesting/android-app-pentesting/android-task-hijacking","android:launchMode=""singleTask"" (resources/AndroidManifest.xml)"
"5","low","Insecure Random Used","NA","The Insecure Random Number vulnerability occurs when a system uses a flawed or predictable algorithm to generate random numbers. This can compromise security features that rely on randomness, such as password generation, session IDs, and cryptographic keys. Attackers can potentially predict these numbers, leading to unauthorized access or data breaches.","To mitigate insecure random number generation, replace any weak or predictable random number generators with cryptographically secure pseudo-random number generators (CSPRNGs) provided by the operating system or a trusted library. Ensure that the CSPRNG is properly seeded with a high-entropy source. Regularly audit the application's use of random numbers to verify that CSPRNGs are used correctly and that seeds are properly managed. Avoid using predictable sources, such as system time or process IDs, as the sole source of entropy. Implement regular testing and validation of the random number generator to ensure its continued security and unpredictability. Consider using hardware random number generators (HRNGs) for applications requiring the highest level of security.","https://owasp.org/www-project-top-ten/2017/A6_2017-Security_Misconfiguration.html, https://cwe.mitre.org/data/definitions/330.html","import java.util.Random; (sources/com/google/firebase/database/o/m/a.java)
import java.util.Random; (sources/com/google/firebase/database/s/i.java)"
